Code,Product label,2001,2002,2003,2004,2005,2006,2007,2008,2009,2010,2011,2012,2013,2014,2015,2016,2017,2018,2019
'27,"Mineral fuels, mineral oils and products of their distillation; bituminous substances; mineral ...",51860985,56120645,73055566,99612852,149534898,190010930,216515402,307371505,190171159,262683510,352185423,368853370,372036096,346119387,168737648,134703176,173299849,237591878,220845173
'99,Commodities not elsewhere specified,12356012,9665364,11951349,15655670,19991393,24452955,28442453,34902452,26441099,28770972,41455938,17,0,11646991,55364811,45239262,52887528,63746027,55265424
'72,Iron and steel,5547426,6410897,8375672,15973591,17870944,17852127,21114771,28602694,14724663,18756824,21980053,22607920,20069844,20555655,14911751,14121803,18762190,23357805,18140726
'71,"Natural or cultured pearls, precious or semi-precious stones, precious metals, metals clad ...",1137864,3382887,4012057,4934265,1682113,3929010,3674028,4569036,4072886,7283997,3726585,13823062,14301028,11845174,7433037,8905706,11048244,10097534,15258928
'84,"Machinery, mechanical appliances, nuclear reactors, boilers; parts thereof",3314812,2923779,3311807,3723069,4213189,4931533,5881224,7151255,5580509,5283176,5330009,7642193,8867923,9256932,8144186,6800758,8541411,9170893,8991536
'44,Wood and articles of wood; wood charcoal,2463613,2940768,3472459,4522693,5690203,6638727,8850107,7785889,5573371,6093699,6973753,6735497,7330192,7763749,6151899,6523925,7901563,9009169,8619543
'31,Fertilisers,1675983,1646501,1964489,2841225,3881149,4083714,5696830,11832362,5504914,7371152,10077950,11176892,9121229,8988266,8611516,6637347,7217054,8225604,8401891
'10,Cereals,271594,996801,1111652,646358,1350412,1550684,4083868,3254542,3444369,2396097,4438710,6251741,4752137,7086716,5525632,5606085,7527187,10457675,7921429
'76,Aluminium and articles thereof,4434908,3680936,4018642,4838629,5471523,7034198,8147323,8653406,5791207,6668975,7739851,7262288,7124584,6325357,6880992,5980102,6673318,6555519,5839023
'85,"Electrical machinery and equipment and parts thereof; sound recorders and reproducers, television ...",1348997,1217418,1243188,1670601,1851387,2422416,2683080,3271081,2619985,2518089,3306254,4530240,4977307,4929046,3385884,4049924,4321764,4911607,5559090
'74,Copper and articles thereof,1050802,947770,1100812,2092578,2535200,4434484,4658581,4117013,3557625,4922668,4999217,5789902,4964884,4905124,4167354,3312616,4709107,5372205,5222098
'03,"Fish and crustaceans, molluscs and other aquatic invertebrates",390482,383842,408337,326552,456670,526534,517458,471661,1708271,2156506,2378506,2508059,2819062,2868303,2748186,3015282,3482367,4282356,4663054
'26,"Ores, slag and ash",266728,264760,336864,628284,1081921,1054412,1592120,2374813,1176771,2159071,4027534,3888232,3615687,3300515,1935942,2014981,3070402,3672883,4182318
'87,"Vehicles other than railway or tramway rolling stock, and parts and accessories thereof",874793,1467799,1486518,1936626,2024617,2427454,3117276,3645377,2379938,2201013,3001074,4646993,4821553,3246557,2646716,2563801,3433053,3150857,3758155
'73,Articles of iron or steel,780764,755613,1051927,1446999,1957306,2174033,2494328,3089760,3104040,1392686,2070777,3057776,3439573,3152619,2268970,2263777,3441017,4075683,3718506
'29,Organic chemicals,1126388,1159941,1507930,2204763,2673454,3065939,3679479,3886410,2205446,3128307,4289212,4518102,4600466,4489928,2919419,2409098,3236758,4199559,3674541
'28,"Inorganic chemicals; organic or inorganic compounds of precious metals, of rare-earth metals, ...",940837,782260,1041523,1414651,1851486,2315503,2608375,3671776,2212541,6478694,7892155,7838650,8035055,5130821,3729496,2385464,2630878,3620239,3453958
'15,Animal or vegetable fats and oils and their cleavage products; prepared edible fats; animal ...,61210,57162,70989,131372,241095,475862,588890,928422,895941,680141,1059169,2256602,2185193,2266295,1828312,2208572,2713699,2669298,3436428
'40,Rubber and articles thereof,591018,658010,875502,1156446,1504562,1863528,2202143,2832160,1858496,2763548,3894949,3954805,3788389,3018825,2418928,2543292,3137653,3162405,3032437
'39,Plastics and articles thereof,561060,490860,521832,688299,717815,843004,1295132,1410407,1276471,1236002,1550603,2096328,2570423,2680924,2258695,2251873,2814439,3172085,3025527
'75,Nickel and articles thereof,1123018,1960056,2271094,3249811,3605635,6371379,8837151,5189197,3669145,5446954,4688943,3950321,3775342,4021266,2507475,2018758,2058273,2606922,2985414
'48,"Paper and paperboard; articles of paper pulp, of paper or of paperboard",926947,887189,968977,1184557,1330992,1428157,1599635,1791635,1539560,1457977,1732653,1924529,2055068,2260192,1790876,1899539,2197132,2737863,2491262
'90,"Optical, photographic, cinematographic, measuring, checking, precision, medical or surgical ...",1059875,641469,613660,671123,699500,775538,952350,1176091,996865,1081009,1176512,1453853,1550242,1432539,1210037,1428545,1877389,1739321,1813803
'23,Residues and waste from the food industries; prepared animal fodder,33992,27467,56166,105840,102082,128260,229798,270422,272346,308668,411977,827398,1041975,1229025,934735,945204,865589,1084483,1257538
'47,Pulp of wood or of other fibrous cellulosic material; recovered (waste and scrap) paper or ...,532198,556822,623668,695657,763523,850694,1058696,1179629,712777,1147305,1361360,1215523,1125233,1194710,1129432,1084716,1228732,1655261,1122969
'25,"Salt; sulphur; earths and stone; plastering materials, lime and cement",283070,317757,387897,458446,569409,624681,752183,2221822,873284,871731,1368650,1726969,1428592,1396611,1090832,948588,1041937,1122362,1080136
'12,"Oil seeds and oleaginous fruits; miscellaneous grains, seeds and fruit; industrial or medicinal ...",55504,26421,84132,54550,87646,91259,85339,100903,117681,83803,205166,402969,342555,369836,388547,519659,641062,762985,1010573
'81,Other base metals; cermets; articles thereof,464406,337123,404659,653966,696137,952024,1201498,1209910,726450,792575,809775,895258,800056,804261,715292,719128,817370,1148577,1000549
'38,Miscellaneous chemical products,161077,186669,220271,241609,302566,427679,408607,431764,301631,305200,354002,534688,642475,695888,518988,534805,704634,881614,995741
'86,"Railway or tramway locomotives, rolling stock and parts thereof; railway or tramway track fixtures ...",171679,209708,396052,485005,493056,596822,687036,1008803,446880,397515,585557,1476289,832942,776937,553872,522217,618418,886927,910555
'30,Pharmaceutical products,89315,116787,192973,171604,191602,226791,298465,308656,309383,313700,336905,638807,585531,617154,529746,634624,728113,791999,843795
'33,"Essential oils and resinoids; perfumery, cosmetic or toilet preparations",52685,68621,94069,123863,156851,201088,261940,308493,292877,260755,296895,472845,559559,519995,397947,498838,657251,683982,772309
'70,Glass and glassware,129049,80843,96167,127955,154700,262699,338632,387592,324265,232798,276230,488767,604070,596442,449329,550128,673369,744433,755462
'18,Cocoa and cocoa preparations,61155,75459,100315,143507,184460,218830,289863,346339,291092,256382,327029,558582,669178,652654,431103,483775,553664,640488,725515
'21,Miscellaneous edible preparations,59786,64930,114056,162499,229894,259794,348820,441582,367546,240246,285892,482645,611706,606375,485959,505636,624854,672330,699638
'19,"Preparations of cereals, flour, starch or milk; pastrycooks' products",43014,50667,87854,132448,169987,218385,315802,383483,288602,187552,225823,434216,577115,623218,498467,518583,557677,579192,687951
'94,"Furniture; bedding, mattresses, mattress supports, cushions and similar stuffed furnishings; ...",124780,118858,172254,253474,299494,378926,474980,471257,351425,293153,263830,449309,467998,464011,377304,409657,494236,567507,666335
'22,"Beverages, spirits and vinegar",75209,110567,141719,143086,210883,299913,388765,459855,341118,287094,346974,532038,584576,552170,417036,453844,498907,555242,615246
'02,Meat and edible meat offal,3791,2518,1772,1841,4621,6677,5996,17142,21741,26965,25227,60181,86132,104770,115170,218576,323689,407175,591289
'49,"Printed books, newspapers, pictures and other products of the printing industry; manuscripts, ...",313641,306486,289648,332824,321346,355429,419400,396250,341936,281730,278072,281211,469192,432532,533393,282874,491615,515198,550822
'24,Tobacco and manufactured tobacco substitutes,45088,68313,110190,120973,222311,243814,306467,430370,467512,332212,418202,674025,735159,816302,750310,685890,616166,519138,535190
'68,"Articles of stone, plaster, cement, asbestos, mica or similar materials",76422,82777,106788,164171,216530,292372,367808,362231,274494,211741,287356,458226,491295,425700,341638,347788,427072,526593,532733
'17,Sugars and sugar confectionery,65153,78524,61971,78797,80312,124641,194333,137489,135726,97568,194295,278307,274804,260863,171729,244901,489550,414607,512280
'34,"Soap, organic surface-active agents, washing preparations, lubricating preparations, artificial ...",94748,100253,145492,214543,275852,344068,430435,523751,376539,275268,280483,448870,499598,448205,391552,405193,736661,508119,490466
'89,"Ships, boats and floating structures",508952,446896,349361,481104,564978,1059923,944504,1327746,625423,2285905,1609491,2219183,2300836,824156,537666,634553,951710,723846,481835
'07,Edible vegetables and certain roots and tubers,19893,27306,37504,51303,54412,68439,63867,76826,108645,63184,246940,340022,248813,246280,376995,478791,494579,406614,468869
'32,"Tanning or dyeing extracts; tannins and their derivatives; dyes, pigments and other colouring ...",89413,63975,114486,90043,95858,117822,157159,160219,125878,131494,155973,213861,212257,199733,250669,238726,303804,316808,349527
'20,"Preparations of vegetables, fruit, nuts or other parts of plants",12733,14524,24503,35085,60484,72256,82911,100069,87625,45797,58579,172710,243699,267699,226820,223578,258541,296605,341467
'11,Products of the milling industry; malt; starches; inulin; wheat gluten,41569,23651,60330,42493,55310,81136,168784,276189,188876,84547,318057,157829,164551,182754,253062,242966,228544,262158,328147
'69,Ceramic products,61796,59681,79257,98905,125192,163886,212015,201641,174198,145239,135987,289309,257665,268725,209106,236391,283133,310423,322979
'96,Miscellaneous manufactured articles,3273,5760,17348,7050,11924,9026,11784,9985,38081,223451,8601,141667,192416,257047,225675,234666,424335,296948,306722
'04,"Dairy produce; birds' eggs; natural honey; edible products of animal origin, not elsewhere ...",79373,61443,74654,99390,131692,177176,244545,294909,225865,106842,119834,297126,325178,316643,216278,224769,259569,252416,272594
'64,"Footwear, gaiters and the like; parts of such articles",21709,19775,24356,26843,27002,29031,31779,30079,28325,25555,32157,103212,148891,220775,151506,174911,183417,231459,270133
'62,"Articles of apparel and clothing accessories, not knitted or crocheted",153035,144069,133508,116391,121196,93474,108784,84942,66753,63984,79458,127328,164781,211486,149883,149120,198240,201793,236441
'61,"Articles of apparel and clothing accessories, knitted or crocheted",48942,63059,57028,47137,37377,19019,17383,17357,17659,18249,21774,76887,117989,147902,111971,120098,161078,173354,215963
'82,"Tools, implements, cutlery, spoons and forks, of base metal; parts thereof of base metal",366228,113849,111589,130175,158981,167167,210968,230023,148961,132903,219001,396342,252288,220752,161700,168184,213479,204200,197168
'16,"Preparations of meat, of fish or of crustaceans, molluscs or other aquatic invertebrates",73800,55620,46956,63317,110262,113540,146590,193539,142063,77704,85164,182802,207488,177445,119618,132342,168308,182248,194508
'95,"Toys, games and sports requisites; parts and accessories thereof",10257,11379,16696,19170,32361,52380,50187,79181,58365,69725,88835,102256,107462,125800,100805,103713,137250,164578,193038
'83,Miscellaneous articles of base metal,44087,35406,46257,49278,81421,134365,146000,145597,86837,68878,62776,124221,162306,138425,130289,144125,166381,176116,189672
'09,"Coffee, tea, maté and spices",7815,6721,12290,28942,41451,56774,78287,100034,86254,74487,85446,135721,161141,144476,123933,141092,157645,161124,171005
'78,Lead and articles thereof,4797,2594,2388,15128,11634,53849,163234,150765,142569,185200,205412,200467,195894,188818,172413,231217,275932,240243,166672
'56,"Wadding, felt and nonwovens; special yarns; twine, cordage, ropes and cables and articles thereof",12372,16414,27516,28879,30390,38762,43265,56188,68338,58252,70052,98398,110035,117645,107147,123275,141366,160397,161838
'08,Edible fruit and nuts; peel of citrus fruit or melons,42275,32778,65197,89107,66027,104036,83846,66520,55129,21752,51818,107493,82516,87205,81175,76962,103299,111018,118752
'05,"Products of animal origin, not elsewhere specified or included",12683,7372,9670,10810,16224,21661,21395,23350,18033,21878,35557,47655,79267,71954,66892,74362,88057,100853,116852
'63,Other made-up textile articles; sets; worn clothing and worn textile articles; rags,35626,41307,39463,46124,47536,40730,52896,62121,43309,37560,39876,58342,69140,79497,62226,68084,84287,92065,115443
'36,Explosives; pyrotechnic products; matches; pyrophoric alloys; certain combustible preparations,58714,50005,59025,63075,53983,93771,74522,87259,75246,49962,72081,137466,134931,140058,150379,106904,148550,130208,112795
'41,Raw hides and skins (other than furskins) and leather,123776,131444,153260,156436,155002,170375,178980,185283,127379,176897,201707,233149,236220,251796,176373,152657,161090,141223,87723
'54,Man-made filaments; strip and the like of man-made textile materials,39815,38427,38623,44743,44525,41541,35148,19592,16934,29055,44869,44847,48138,51322,44086,46379,56278,68774,70061
'59,"Impregnated, coated, covered or laminated textile fabrics; textile articles of a kind suitable ...",27018,51376,26530,35915,42510,41239,50508,49047,41745,28385,35412,62257,57125,62427,45743,51086,54257,64335,64814
'55,Man-made staple fibres,43116,46285,57697,73266,58079,63405,64227,32976,28037,19889,21440,48728,53559,58984,36513,42757,64967,63141,58571
'52,Cotton,138666,133142,147460,158014,133251,122872,104321,74546,44743,45183,48437,60414,62191,59420,41906,49247,63405,53513,57249
'42,"Articles of leather; saddlery and harness; travel goods, handbags and similar containers; articles ...",20601,14623,26656,36839,49245,42731,45656,33783,27240,26018,29511,24026,36127,46122,35147,42061,46026,51894,54850
'35,Albuminoidal substances; modified starches; glues; enzymes,57153,44867,41039,48926,36485,34674,30899,25831,20011,17601,13248,26700,32982,36666,27957,33047,42659,47946,51857
'43,Furskins and artificial fur; manufactures thereof,30856,40446,53468,59286,79321,113254,64876,83578,52561,55736,100033,246205,336777,118183,87160,66930,78649,61757,50500
'01,Live animals,2916,4620,8187,8072,3352,3464,2824,5679,8500,4739,6698,11549,16393,28925,20894,22645,30785,42656,49261
'60,Knitted or crocheted fabrics,381,359,919,1482,2014,2021,1709,1451,887,1253,1588,8089,8953,7607,9447,12542,13877,18422,32091
'91,Clocks and watches and parts thereof,6351,6342,7330,6912,8407,10279,8935,16264,4739,4212,6154,8195,15607,15714,12783,26653,24438,21747,31130
'79,Zinc and articles thereof,102235,93955,54246,66431,60514,219606,294708,173332,113379,162690,137158,105032,41457,106285,68617,109586,128319,95593,23469
'14,Vegetable plaiting materials; vegetable products not elsewhere specified or included,134,74,61,49,325,3540,5756,7854,5892,6173,8729,12897,11595,12003,11240,9278,6735,9228,18834
'65,Headgear and parts thereof,6379,5729,5996,4411,7938,3396,3480,3855,4369,2841,3871,9533,17031,13394,11433,11932,12699,14329,18385
'51,"Wool, fine or coarse animal hair; horsehair yarn and woven fabric",18897,30094,31702,22596,18673,19926,28679,20295,11582,15880,16189,22852,32665,31917,34546,23461,26341,23178,17528
'37,Photographic or cinematographic goods,4257,4270,6287,9275,13238,8540,22054,12636,6364,4713,4374,6474,6339,10150,7584,8066,9278,10851,13551
'53,Other vegetable textile fibres; paper yarn and woven fabrics of paper yarn,51576,62131,77415,88109,76792,68617,43913,21908,17506,16227,18649,21558,17961,10882,10117,9695,7769,10942,13449
'58,Special woven fabrics; tufted textile fabrics; lace; tapestries; trimmings; embroidery,695,511,604,698,588,821,844,1043,940,1313,1710,8254,9406,8560,5757,9019,10560,11355,13429
'57,Carpets and other textile floor coverings,1598,1237,1498,2371,2557,4389,4872,4842,3234,2030,2146,6227,8698,6398,4314,5580,7752,9649,12315
'13,"Lac; gums, resins and other vegetable saps and extracts",222,139,826,1270,800,904,2008,1112,615,959,1549,3683,4689,6991,6225,8556,11130,11872,11389
'80,Tin and articles thereof,9955,9157,3298,8156,8912,4063,12538,10780,6572,4635,7604,15419,20064,10807,6655,6903,6040,41658,8729
'92,Musical instruments; parts and accessories of such articles,1279,1451,1046,1090,1081,1239,1745,996,927,219,1331,1630,690,892,634,1372,1458,5087,8042
'97,"Works of art, collectors' pieces and antiques",1254,6213,1208,2801,1559,722,2123,3480,1212,3204,2360,3453,4664,5285,4325,7974,6433,9244,6111
'06,"Live trees and other plants; bulbs, roots and the like; cut flowers and ornamental foliage",374,500,783,1024,776,1011,837,1222,1336,1169,1504,1359,2553,2095,2751,3153,3988,3143,5494
'67,Prepared feathers and down and articles made of feathers or of down; artificial flowers; articles ...,260,117,160,148,179,108,192,210,186,286,80,299,901,1499,1070,1177,1552,3315,4063
'66,"Umbrellas, sun umbrellas, walking sticks, seat-sticks, whips, riding-crops and parts thereof",55,45,36,179,325,82,319,413,368,96,162,438,694,557,636,828,994,1452,2001
'45,Cork and articles of cork,192,278,276,247,156,170,206,394,253,62,37,359,464,638,1161,923,878,1267,1776
'46,"Manufactures of straw, of esparto or of other plaiting materials; basketware and wickerwork",153,248,549,512,1779,196,228,237,176,124,123,227,242,328,307,333,407,440,643
'50,Silk,14,23,17,31,8,13,36,1,11,8,7,46,251,135,67,70,31,72,78
'93,Arms and ammunition; parts and accessories thereof,21481,26062,29810,29700,30213,32275,42204,50082,495355,2308346,3557537,3562182,4451765,189240,0,0,0,0,0
'88,"Aircraft, spacecraft, and parts thereof",345519,2203956,2808359,2673970,726630,0,0,0,0,0,0,4375548,5559153,1164199,0,0,0,0,0
