Code,Product label,2001,2002,2003,2004,2005,2006,2007,2008,2009,2010,2011,2012,2013,2014,2015,2016,2017,2018,2019
'84,"Machinery, mechanical appliances, nuclear reactors, boilers; parts thereof",53301011,50479982,55002058,59722434,63702188,74270278,73183295,69966645,53872695,58467343,68543899,66520131,70532997,71611244,64402456,60334401,65387357,72382471,73019511
'87,"Vehicles other than railway or tramway rolling stock, and parts and accessories thereof",21591133,26790443,30445175,35860100,37657140,39017332,46039948,44638915,28592235,37930397,46022808,47533882,50994806,54409455,50740491,51311032,53731073,54702459,50451093
'71,"Natural or cultured pearls, precious or semi-precious stones, precious metals, metals clad ...",14357648,11832516,12308752,15546675,23123309,18797713,20176564,36911933,16719130,30067524,63753440,37465019,99889282,53630284,55057705,28516697,33180458,47432822,42516199
'27,"Mineral fuels, mineral oils and products of their distillation; bituminous substances; mineral ...",22620995,23320249,25714217,31245851,36941625,43928931,46758839,62694618,39981963,52817507,66058612,66486254,62365066,55018455,32985991,25744099,35362905,46430792,40963393
'85,"Electrical machinery and equipment and parts thereof; sound recorders and reproducers, television ...",43247225,43277782,35827297,38359198,51713340,84337196,37221645,36374522,29538091,31997922,34474656,30753213,30928795,31900654,29127479,26836762,28458545,28873806,28331394
'30,Pharmaceutical products,12875156,14855626,19214537,21732803,21057804,25080694,28310258,31305624,30518882,33219881,33157245,33101563,32094368,33567373,35973438,32579905,32714027,30082207,26928329
'90,"Optical, photographic, cinematographic, measuring, checking, precision, medical or surgical ...",11356906,11093405,11909245,13847623,14777655,16076887,16437784,16853841,14630175,15946439,17826312,17312614,18569927,19473521,18411597,17122246,18010277,19092477,19830188
'88,"Aircraft, spacecraft, and parts thereof",9253344,8838577,10535609,11798029,10937868,11956991,25718,14260075,11996565,13804991,15952456,16736449,17851668,16667281,18999600,20532348,20981530,19319816,18325803
'29,Organic chemicals,9457001,9336896,10745748,11948186,12965707,15652458,14952120,16395644,15423138,14727388,17442890,17382642,12765620,10770074,13948039,9903234,10576287,11302425,12630359
'97,"Works of art, collectors' pieces and antiques",3032872,3992307,4759979,4587405,5445849,5168856,6678925,5252372,3394441,5288618,5443082,7475596,6901778,7748696,9240768,7167176,6551025,7182779,12366156
'39,Plastics and articles thereof,6861465,7355721,8593158,9931159,10880606,11418412,12305590,12580629,9661771,11096547,12810866,11802259,12088983,12816238,11821145,10947608,11892715,12385306,11861729
'99,Commodities not elsewhere specified,929167,944319,823908,767552,884886,1479713,28290520,2856503,2574177,3076114,4461922,5273537,5512539,13568524,6055684,12054914,8925942,21332985,11255977
'22,"Beverages, spirits and vinegar",4846264,5093136,5884598,6254148,6594761,7056291,8416234,8702607,7973845,8854712,11146396,10907910,10985422,11000506,9874431,9484600,9797750,10506148,10243288
'38,Miscellaneous chemical products,3955259,4409379,5026433,5681896,5863294,6244738,7009234,7811959,6446958,6552934,7550689,7274250,7420988,7999114,7312616,6301860,6376771,6912362,6976227
'72,Iron and steel,3626953,3855249,5269720,8160593,9293394,9600655,12314557,13583276,6843528,8958991,11383938,9771624,10133063,10280414,7270786,5358195,7005198,7881141,6562686
'73,Articles of iron or steel,3291055,3471499,4114205,4653220,5294943,6048400,7391463,7419001,5833746,5350746,6299050,6417569,6528900,7110552,6082764,5289536,5335652,5697233,5761208
'33,"Essential oils and resinoids; perfumery, cosmetic or toilet preparations",3055830,3351756,3937126,4318308,4247210,5063792,5531470,5345265,4697422,4953391,5691014,5543976,6129798,6389094,5504745,5501126,5853739,6013978,5729221
'62,"Articles of apparel and clothing accessories, not knitted or crocheted",1988867,1995389,2305093,2616152,2533345,2739632,3165811,3202876,2754335,2904117,3543906,3698593,4194220,4802296,4713198,4472622,4470525,4559051,4503104
'94,"Furniture; bedding, mattresses, mattress supports, cushions and similar stuffed furnishings; ...",1925341,1886757,2127010,2564665,2724912,2905677,3431590,3236376,2324475,2496110,3021402,2976736,3150711,3653743,3598697,3589127,3985953,4044078,4260079
'61,"Articles of apparel and clothing accessories, knitted or crocheted",1453801,1585338,1861003,2172925,2090118,2213831,2587711,2496598,2242715,2332465,2807105,2675838,3287939,3685645,3570594,3433028,3559720,3899872,3925304
'49,"Printed books, newspapers, pictures and other products of the printing industry; manuscripts, ...",3003645,3410762,4031546,4620430,4491720,4553755,4643111,5002298,4385872,4246909,4372655,4229027,4193938,4354592,4124527,3590794,3689230,3832929,3636291
'32,"Tanning or dyeing extracts; tannins and their derivatives; dyes, pigments and other colouring ...",2311709,2574892,2922349,3188434,3384580,3483714,3583239,3809185,3037047,3278019,4089642,3449207,3607929,3853864,3370148,3282844,3526120,3692538,3450305
'48,"Paper and paperboard; articles of paper pulp, of paper or of paperboard",3106117,3209466,3576328,3877558,3947082,3985067,4488950,4660035,3763169,3821425,4076638,3486789,3603217,3689671,3079762,3006842,3045325,3274468,3059426
'76,Aluminium and articles thereof,2093398,2115918,2213050,2799940,3327601,4166070,4759921,4726412,2529462,3450136,3830292,3227701,2919297,3227561,2928558,2686579,2844393,3241850,2885346
'21,Miscellaneous edible preparations,849237,894934,1065695,1303446,1318128,1440719,1664049,1754634,1609996,1801843,2116668,2085121,2283419,2687457,2596065,2589153,2710870,2977567,2866622
'40,Rubber and articles thereof,2129821,2182893,2565591,2934294,2986686,3202090,3374462,3719299,2878653,3141911,4269513,3721150,3634738,3262466,2959142,2477048,2809956,2625042,2637652
'64,"Footwear, gaiters and the like; parts of such articles",703533,678708,721086,805099,875394,962746,1095268,1165825,1137997,1298888,1514115,1594825,1899789,2104166,2211092,2161956,2158212,2348196,2439878
'04,"Dairy produce; birds' eggs; natural honey; edible products of animal origin, not elsewhere ...",816379,862656,1125501,1396140,1239608,1246088,1551387,1578658,1227210,1522546,1879360,1718452,2031023,2332440,1842002,1744937,2144276,2399472,2423101
'19,"Preparations of cereals, flour, starch or milk; pastrycooks' products",1173719,1264065,1407105,1605779,1669865,1761585,2020051,2093618,1920220,1857526,2100054,2134472,2291421,2448465,2266412,2039436,2147684,2422264,2357432
'03,"Fish and crustaceans, molluscs and other aquatic invertebrates",961957,1030277,1374264,1511163,1575027,1615373,1789769,1682537,1668886,1910527,2189783,1855121,2089083,2365124,1862228,2043149,2264033,2178078,2349607
'02,Meat and edible meat offal,497597,628454,826724,1056439,1109693,1193379,1442698,1793733,1619807,1848078,2400964,2135466,2290053,2384422,1930128,1890463,2066623,2186956,2339359
'95,"Toys, games and sports requisites; parts and accessories thereof",1089749,1276650,1364221,1481706,1500289,1604804,2068361,2026334,1746116,1872108,2020468,1798329,1911447,2240149,1968019,2028196,2199951,2526082,2321245
'34,"Soap, organic surface-active agents, washing preparations, lubricating preparations, artificial ...",1096945,1204397,1501207,1787538,1832082,1860724,2269324,2272045,2121674,2078919,2454768,2410362,2561141,2648049,2325153,2194017,2288545,2369351,2227376
'28,"Inorganic chemicals; organic or inorganic compounds of precious metals, of rare-earth metals, ...",2391296,2082321,2387349,2832810,2911766,3989530,2114136,5232221,4704648,5377646,4832096,4515886,3998242,1478844,2627832,1134432,2047364,1390731,2223531
'89,"Ships, boats and floating structures",640236,660598,1020165,1249415,1229558,1212365,1795152,2208711,1388843,2249106,1535277,1454692,1672644,1532011,1518876,1944432,1192697,1434205,2137699
'74,Copper and articles thereof,933525,850340,935203,1277177,1402904,2435172,2505596,2650545,1777538,2549571,3349717,2790358,2318170,2085967,1628774,1666814,1876720,1847138,1722350
'23,Residues and waste from the food industries; prepared animal fodder,410951,476697,540924,578615,570337,669117,847318,978305,914730,997606,1116539,1259251,1443596,1472361,1380378,1504200,1745700,1573205,1431123
'75,Nickel and articles thereof,538428,474825,541258,907840,1072817,1353795,1994141,1553084,789410,1286972,1691964,1497937,1445205,1509933,1255314,1085583,1209035,1418929,1401209
'70,Glass and glassware,1025649,1032809,1262415,1482137,1277301,1326477,1495942,1508677,1129909,1205640,1394883,1261161,1220759,1275606,1195996,1180727,1249908,1292268,1293347
'42,"Articles of leather; saddlery and harness; travel goods, handbags and similar containers; articles ...",366027,395320,439881,504575,536220,614438,742489,700311,618379,738421,924024,940477,1013850,1087064,1178950,1084099,1132826,1268480,1271077
'83,Miscellaneous articles of base metal,782151,731792,919250,1045338,1102595,1162942,1408547,1635207,1175785,1245251,1230255,1226799,1351435,1419656,1294189,1287147,1172048,1229000,1242773
'68,"Articles of stone, plaster, cement, asbestos, mica or similar materials",720284,695437,808385,1031130,1151355,1276896,1400341,1326565,931426,1040734,1162184,1116529,1137018,1333973,1157624,1081168,1152663,1190873,1130926
'91,Clocks and watches and parts thereof,235313,233588,272755,303519,341942,316366,381080,392623,348197,382114,559100,641504,799542,856401,993319,984696,1091310,1048101,1117109
'63,Other made-up textile articles; sets; worn clothing and worn textile articles; rags,440372,456869,556862,644408,706097,810324,920473,941128,849259,910090,994918,1032343,1142084,1146920,1034527,1009217,1048243,1112906,1088906
'18,Cocoa and cocoa preparations,501658,540784,581904,607909,644366,630854,774000,795927,687580,704080,765312,896412,976307,1035788,960089,951005,975477,1070063,1049312
'81,Other base metals; cermets; articles thereof,448338,409568,366793,450129,638115,702629,783069,780178,551465,693291,856720,794329,789971,866247,820372,803516,879016,986198,1004675
'82,"Tools, implements, cutlery, spoons and forks, of base metal; parts thereof of base metal",1806056,1816747,1816888,2142229,1860675,2177704,1693879,1738366,1147579,1343978,1388540,1282222,1303490,1343416,1136483,996115,1045358,1084251,988681
'93,Arms and ammunition; parts and accessories thereof,456672,498906,387642,661173,1036841,764772,143441,534981,592996,490068,730770,847230,1119247,152904,2015114,243486,1288906,134646,949937
'10,Cereals,337010,344734,692574,573467,554069,509868,678287,1018884,720004,1000238,980953,681615,488538,702099,859852,944624,454272,410559,752645
'01,Live animals,525390,532516,728343,785877,735239,678983,902445,830465,674194,584142,645635,578096,618258,669022,674895,680028,711895,708696,725851
'15,Animal or vegetable fats and oils and their cleavage products; prepared edible fats; animal ...,241671,429272,509260,496330,505908,575240,721593,778437,684414,743621,801124,802654,845855,823697,701437,643031,722370,776640,712645
'20,"Preparations of vegetables, fruit, nuts or other parts of plants",263062,280816,303295,382466,367948,411032,498692,555532,479755,486193,557684,542292,610154,667139,649560,669584,739446,784977,705217
'96,Miscellaneous manufactured articles,473688,476288,616555,603424,532630,550130,591921,576582,487811,492900,563443,808628,749674,846686,781167,756626,739253,740503,677624
'25,"Salt; sulphur; earths and stone; plastering materials, lime and cement",643516,644064,757226,821858,841787,918539,951328,871301,645101,694342,804377,700123,723305,729577,646240,568424,648570,699923,663132
'69,Ceramic products,761632,709332,805174,858380,839091,896289,975365,870322,560369,571450,621509,599223,585327,661157,590941,553629,597193,655887,592538
'44,Wood and articles of wood; wood charcoal,468325,514749,698514,749466,843995,775201,815709,683631,470340,512781,587686,537253,554685,606940,512666,502536,534704,596522,589244
'35,Albuminoidal substances; modified starches; glues; enzymes,514682,578053,682926,631841,568283,593837,552530,555028,430789,465914,560017,525281,546271,543852,552800,485195,552150,581890,579116
'07,Edible vegetables and certain roots and tubers,213430,273360,350263,377080,362706,382716,438086,469880,480052,490123,538294,481099,536086,524101,507253,515267,476035,520860,574341
'09,"Coffee, tea, maté and spices",254176,269011,317220,336531,314248,359944,413578,465962,438761,529202,523200,475925,581512,599589,567246,556343,582254,572924,566785
'47,Pulp of wood or of other fibrous cellulosic material; recovered (waste and scrap) paper or ...,112478,158558,293042,458545,519797,619610,829014,887718,555953,838419,997939,849825,784633,793811,765560,750285,841441,770607,564298
'54,Man-made filaments; strip and the like of man-made textile materials,1044552,1043711,1114749,1149188,981147,993153,701391,886541,691765,792483,863158,816672,848197,493088,758581,371488,712586,447632,539057
'17,Sugars and sugar confectionery,511260,486577,553506,696525,668014,710806,778542,813397,691633,665645,584837,558620,561131,645646,551069,494772,478689,564022,529904
'78,Lead and articles thereof,100675,110149,97975,133736,158081,270948,378210,464584,447082,571656,598625,548991,526930,540476,513570,522247,618262,598418,519940
'16,"Preparations of meat, of fish or of crustaceans, molluscs or other aquatic invertebrates",228651,234848,277859,342565,372392,376344,606933,613181,504941,480777,565125,583654,526836,586578,485051,414505,462002,543070,502956
'51,"Wool, fine or coarse animal hair; horsehair yarn and woven fabric",528377,490318,503168,613711,616299,597703,530772,516336,388168,447290,573258,526394,559794,599980,538854,484947,484333,518794,496129
'11,Products of the milling industry; malt; starches; inulin; wheat gluten,227321,252377,258338,289931,252221,223630,281901,388045,388725,385367,456542,486322,491502,478496,426194,422387,487327,460610,434819
'56,"Wadding, felt and nonwovens; special yarns; twine, cordage, ropes and cables and articles thereof",333046,336000,417409,429122,435400,506948,502410,482572,373953,408238,448023,426579,418629,452744,413970,367223,374418,397964,425184
'59,"Impregnated, coated, covered or laminated textile fabrics; textile articles of a kind suitable ...",486205,505226,609095,678632,654807,672579,714152,684844,548728,598543,697314,605023,631400,624002,550147,519199,484367,468532,400764
'57,Carpets and other textile floor coverings,325894,319987,337747,381372,371185,412850,597067,449534,325372,311469,362596,312560,354137,375502,323734,302192,323967,362742,351019
'55,Man-made staple fibres,675394,762485,864107,955919,869472,784567,645826,706785,584742,674833,801706,785983,635870,522679,464268,315729,417617,323860,348979
'41,Raw hides and skins (other than furskins) and leather,480892,565029,563939,605329,496234,488004,514877,462117,302274,475757,651180,554578,612117,636813,551279,481697,489491,432125,338200
'31,Fertilisers,171483,169157,195424,201325,193087,213372,147111,489990,330842,257982,315693,289666,367499,204215,398370,219215,369092,338430,331666
'08,Edible fruit and nuts; peel of citrus fruit or melons,87766,96239,111695,168960,188025,264905,271931,255462,231411,269500,299786,235804,324556,283547,293539,297469,333202,351259,320530
'86,"Railway or tramway locomotives, rolling stock and parts thereof; railway or tramway track fixtures ...",285321,243333,318642,288434,224528,356471,296792,330067,311761,315100,318383,313137,310156,340289,348119,365292,395282,401367,287032
'65,Headgear and parts thereof,65992,82191,108493,153481,137323,190470,241500,180913,155144,153455,170434,167675,210725,250472,228156,214440,226065,241426,235568
'12,"Oil seeds and oleaginous fruits; miscellaneous grains, seeds and fruit; industrial or medicinal ...",64762,133976,156589,140639,164581,189015,270783,316094,208925,331295,688059,886229,541446,510358,380687,357870,250531,254968,231802
'37,Photographic or cinematographic goods,1498507,1379524,1586470,1414746,1274989,1080860,1032438,1109193,869723,836286,858932,780224,820313,774599,633215,602787,309661,190574,208276
'52,Cotton,350040,354414,362635,373030,296320,363234,320030,298112,214731,234798,271264,255967,266023,303848,233934,180820,176790,202268,201769
'26,"Ores, slag and ash",142257,147814,132560,143479,222202,141404,317993,292408,199506,206030,252170,173143,180386,248394,269032,235636,239879,271719,199521
'58,Special woven fabrics; tufted textile fabrics; lace; tapestries; trimmings; embroidery,199657,217831,246452,288995,249842,230084,256983,247399,175638,190108,192880,210195,198892,216305,184698,184107,192915,199212,175044
'92,Musical instruments; parts and accessories of such articles,87068,84504,103469,104219,93901,85171,102266,96375,72499,79908,85477,75940,94924,122617,105215,118572,133284,151670,173670
'05,"Products of animal origin, not elsewhere specified or included",55518,56557,65026,91780,96640,89582,100777,118738,105267,120170,156493,179806,172159,186293,140420,108065,114063,136995,158952
'79,Zinc and articles thereof,92238,77330,64920,88468,130295,206046,234588,152800,97060,115099,111419,111128,82583,111689,124577,125621,171291,186991,143842
'60,Knitted or crocheted fabrics,208196,201727,229295,267076,277919,208751,196070,205864,162773,177293,205987,152751,174387,169346,173268,149640,126258,147233,140197
'13,"Lac; gums, resins and other vegetable saps and extracts",41876,56028,67004,80531,92682,107343,114838,210563,140946,135527,137090,155622,143573,131334,136822,124485,121197,119103,121970
'06,"Live trees and other plants; bulbs, roots and the like; cut flowers and ornamental foliage",58296,56251,72382,81805,86774,97538,108232,109193,95446,85721,107319,75021,100460,96453,84102,89060,106534,106987,96609
'24,Tobacco and manufactured tobacco substitutes,1350908,1476405,1515386,1402513,1124078,1214399,840390,832007,631414,630537,576995,445346,415975,431607,391243,314242,141434,100158,89790
'36,Explosives; pyrotechnic products; matches; pyrophoric alloys; certain combustible preparations,69187,94555,107049,165987,150562,135205,44163,182921,178512,154451,184057,131135,169532,54347,171520,46769,111004,51328,86394
'53,Other vegetable textile fibres; paper yarn and woven fabrics of paper yarn,111445,118242,134029,133271,112646,104369,110679,86394,56616,50970,59436,50619,53890,56790,51130,51955,49202,56183,55097
'43,Furskins and artificial fur; manufactures thereof,60263,56420,50952,58160,61390,72352,63946,76392,42069,64097,58253,57554,61825,59663,54558,41335,46418,51975,44919
'67,Prepared feathers and down and articles made of feathers or of down; artificial flowers; articles ...,13957,17858,18211,20843,21932,21711,24354,25855,28053,29447,30676,33983,47045,47316,44069,45344,48259,49016,43665
'50,Silk,38096,36615,46251,61249,91129,85910,78256,75784,48398,47460,53668,38704,42956,44239,36108,29297,31322,32630,31420
'66,"Umbrellas, sun umbrellas, walking sticks, seat-sticks, whips, riding-crops and parts thereof",27961,29794,32514,35529,28623,28573,27723,21363,17504,18647,19292,19005,20641,25147,22422,20895,19778,20532,19870
'80,Tin and articles thereof,23473,23925,31049,41205,76783,206068,180995,105283,74519,83943,89972,62398,53304,33727,32030,26591,23551,23022,18542
'46,"Manufactures of straw, of esparto or of other plaiting materials; basketware and wickerwork",4267,5675,7468,6730,8297,8631,11904,9381,9173,8081,8950,7161,8225,9365,7915,8367,7508,11440,8989
'45,Cork and articles of cork,6710,3926,4203,6511,6106,7875,6601,5641,5617,6435,7381,7182,8197,7655,7258,5486,6260,6952,6608
'14,Vegetable plaiting materials; vegetable products not elsewhere specified or included,832,1505,2231,2397,1812,2326,4048,4371,2929,2850,5488,10160,6419,3473,3639,5472,3965,9167,2582
